Headline,Link,Date,Time
"Chokehold cop 'should be fired', says US judge",/news/world-us-canada-49200240,2019-08-02,13:52:58
"Chokehold cop 'should be fired', says US judge",/news/world-us-canada-49200240,2019-08-02,13:52:58
No arms race after US-Russia pact collapses - Nato,/news/world-europe-49207281,2019-08-02,13:52:58
Robert F Kennedy's 22-year-old granddaughter dies,/news/world-us-canada-49201449,2019-08-02,13:52:58
The people risking their lives to save whales,/news/world-us-canada-48998569,2019-08-02,13:52:58
"No defence for Reagan's racism, says daughter",/news/world-us-canada-49207451,2019-08-02,13:52:58
Video 1 minute 22 secondsPlane lands on road and gets 'pulled over',/news/world-us-canada-49199347,2019-08-02,13:52:58
US slaps fresh sanctions on Russia over Skripals,/news/world-us-canada-49210340,2019-08-02,13:52:58
R. Kelly denied bail in sex crime case in New York,/news/world-us-canada-49211063,2019-08-02,13:52:58
Powerful quake off coast of Indonesia,/news/world-asia-49209310,2019-08-02,13:52:58
Video 51 seconds'It looked like an atomic bomb went off',/news/world-us-canada-49199345,2019-08-02,13:52:58
Powerful quake off coast of Indonesia,/news/world-asia-49209310,2019-08-02,13:52:58
Video 51 seconds'It looked like an atomic bomb went off',/news/world-us-canada-49199345,2019-08-02,13:52:58
Stock markets drop on new Trump China tariffs,/news/business-49203034,2019-08-02,13:52:58
By-election loss for Tories cuts Commons majority,/news/uk-wales-politics-49200636,2019-08-02,13:52:58
Heatwave intensity boosted by climate change,/news/science-environment-49205072,2019-08-02,13:52:58
The people risking their lives to save whales,/news/world-us-canada-48998569,2019-08-02,13:52:58
KD Lang on leaving music: 'The muse is eluding me',/news/entertainment-arts-49168221,2019-08-02,13:52:58
Trapped salmon to be airlifted to safety,/news/world-us-canada-49066718,2019-08-02,13:52:58
"A millionaire, a murder and a mystery killer",/news/world-us-canada-49024677,2019-08-02,13:52:58
Boeing crash: I miss them every minute,/news/business-49022003,2019-08-02,13:52:58
Farmer's suicide prevention message in corn maze,/news/world-us-canada-49198411,2019-08-02,13:52:58
BBC World News TV,/news/world_radio_and_tv,2019-08-02,13:52:58
AudioBBC World Service Radio,/sounds/play/live:bbc_world_service,2019-08-02,13:52:58
VideoIs this the 'perfect' wildlife photo?,/news/world-us-canada-49187301,2019-08-02,13:52:58
VideoShocked carp leap from lake after ‘electrofishing’,/news/world-us-canada-49210160,2019-08-02,13:52:58
Video'Now I can make a heart with my hands',/news/world-us-canada-49200369,2019-08-02,13:52:58
VideoHow to untangle a 70-tonne whale,/news/world-us-canada-49199147,2019-08-02,13:52:58
Video'I made a million dollars from eating on YouTube',/news/business-49155693,2019-08-02,13:52:58
VideoIs this the 'perfect' wildlife photo?,/news/world-us-canada-49187301,2019-08-02,13:52:58
VideoPlane lands on road and gets 'pulled over',/news/world-us-canada-49199347,2019-08-02,13:52:58
Video'I made a million dollars from eating on YouTube',/news/business-49155693,2019-08-02,13:52:58
VideoShocked carp leap from lake after ‘electrofishing’,/news/world-us-canada-49210160,2019-08-02,13:52:58
Video'It looked like an atomic bomb went off',/news/world-us-canada-49199345,2019-08-02,13:52:58
The Arctic is on fire - how bad is it?,/news/world-europe-49125391,2019-08-02,13:52:58
The women turned away by doctors in Chile,/news/world-latin-america-49110647,2019-08-02,13:52:58
Stacey Dooley: Face to face with bounty hunters,https://www.bbc.co.uk/bbcthree/article/e96db3dd-0c88-48f6-810c-cb10c7d255aa,2019-08-02,13:52:58
‘I’m being mistaken for a Bollywood sex symbol’,/news/world-asia-india-49188935,2019-08-02,13:52:58
The 'microworkers' making your digital life possible,/news/business-48881827,2019-08-02,13:52:58
Only 35 cancer doctors for nation of 40m people,/news/world-africa-49191685,2019-08-02,13:52:58
Where is al-Qaeda now?,/news/world-asia-48056433,2019-08-02,13:52:58
The holiday village run by spies,/news/stories-43702764,2019-08-02,13:52:58
A mother's heart-breaking choice,https://www.bbc.co.uk/news/extra/gNcHgmLgmv/yazidi-mothers-choice,2019-08-02,13:52:58
What happened to the 2nd Platoon?,https://www.bbc.co.uk/news/resources/idt-sh/Iraq_legacy_of_war,2019-08-02,13:52:58
The murder of Malaciah Thomas,https://www.bbc.co.uk/news/extra/bM7Ycb7XID/The-Murder-Of-Malaciah-Thomas,2019-08-02,13:52:58
The unstoppable rise of Boris Johnson,https://www.bbc.co.uk/news/extra/2gvE3Pa8Gv/Boris_Johnson_battles,2019-08-02,13:52:58
Robert F Kennedy's 22-year old granddaughter dies,/news/world-us-canada-49201449,2019-08-02,13:52:58
"No defence for Reagan's racism, says daughter",/news/world-us-canada-49207451,2019-08-02,13:52:58
No arms race after US-Russia pact collapses - Nato,/news/world-europe-49207281,2019-08-02,13:52:58
Powerful quake off coast of Indonesia,/news/world-asia-49209310,2019-08-02,13:52:58
US slaps fresh sanctions on Russia over Skripals,/news/world-us-canada-49210340,2019-08-02,13:52:58
By-election loss for Tories cuts Commons majority,/news/uk-wales-politics-49200636,2019-08-02,13:52:58
Pentagon pushes pause on $10bn AI tech deal,/news/technology-49204132,2019-08-02,13:52:58
Apple and Google stop workers playing back voices,/news/technology-49205092,2019-08-02,13:52:58
Saudi Arabia allows women to travel independently,/news/world-middle-east-49201019,2019-08-02,13:52:58
Student in Madagascar plane fall 'jumped',/news/uk-england-beds-bucks-herts-49205138,2019-08-02,13:52:58
What is the future of religion?,https://www.bbc.com/future/story/20190801-tomorrows-gods-what-is-the-future-of-religion,2019-08-02,13:52:58
The trick that makes you overspend,https://www.bbc.com/worklife/article/20190801-the-trick-that-makes-you-overspend,2019-08-02,13:52:58
An massive marvel rebuilt every year,https://www.bbc.com/travel/story/20190801-the-massive-mosque-built-once-a-year,2019-08-02,13:52:58
The most important relationship of all?,https://www.bbc.com/culture/story/20190801-hollywoods-new-kind-of-love-story,2019-08-02,13:52:58
The puzzle of ancient brain surgery,https://www.bbc.com/earth/story/20160826-why-our-ancestors-drilled-holes-in-each-others-skulls,2019-08-02,13:52:58
The man who can’t forget,https://www.bbc.com/future/story/20190802-the-man-who-can-remember-every-day-of-his-life,2019-08-02,13:52:58
Did Disney shape how you see the world?,https://www.bbc.com/worklife/article/20190724-did-disney-shape-how-you-see-the-world,2019-08-02,13:52:58
LiveAshes: Burns hits century as England trail by 17 - highlights & reaction,/sport/live/cricket/47324671,2019-08-02,13:52:58
Man Utd to sign Leicester's Maguire for £80m,/sport/football/48989647,2019-08-02,13:52:58
LiveNew EFL season starts with Luton v Woodgate's Middlesbrough,/sport/live/football/49075698,2019-08-02,13:52:58
Burns' maiden century anchors England,/sport/cricket/49212312,2019-08-02,13:52:58
Joshua rematch in UK not happening - Ruiz,/sport/boxing/49203157,2019-08-02,13:52:58
"LiveT20 Blast - live text, clips & radio commentary",/sport/live/cricket/49075788,2019-08-02,13:52:58
VideoWatch Burns reach his maiden Test century,/sport/av/cricket/49206808,2019-08-02,13:52:58
