Headline,Link,Date,Time
No arms race after US-Russia pact collapses - Nato,/news/world-europe-49207281,%yy-08m-02d,11:47:27
No arms race after US-Russia pact collapses - Nato,/news/world-europe-49207281,%yy-08m-02d,11:47:27
Powerful quake off coast of Indonesia,/news/world-asia-49209310,%yy-08m-02d,11:47:27
"No defence for Reagan's racism, says daughter",/news/world-us-canada-49207451,%yy-08m-02d,11:47:27
The people risking their lives to save whales,/news/world-us-canada-48998569,%yy-08m-02d,11:47:27
Video 2 minutes 44 secondsIs this the 'perfect' wildlife photo?,/news/world-us-canada-49187301,%yy-08m-02d,11:47:27
Stock markets drop on new Trump China tariffs,/news/business-49203034,%yy-08m-02d,11:47:27
Robert F Kennedy's 22-year old granddaughter dies,/news/world-us-canada-49201449,%yy-08m-02d,11:47:27
Heatwave intensity boosted by climate change,/news/science-environment-49205072,%yy-08m-02d,11:47:27
Video 51 seconds'It looked like an atomic bomb went off',/news/world-us-canada-49199345,%yy-08m-02d,11:47:27
Video 44 secondsPlane lands on road and gets 'pulled over',/news/world-us-canada-49199347,%yy-08m-02d,11:47:27
Video 51 seconds'It looked like an atomic bomb went off',/news/world-us-canada-49199345,%yy-08m-02d,11:47:27
Video 44 secondsPlane lands on road and gets 'pulled over',/news/world-us-canada-49199347,%yy-08m-02d,11:47:27
Saudi Arabia allows women to travel independently,/news/world-middle-east-49201019,%yy-08m-02d,11:47:27
Katy Perry told to pay $550k to Christian rapper,/news/newsbeat-49202652,%yy-08m-02d,11:47:27
By-election loss for Tories cuts Commons majority,/news/uk-wales-politics-49200636,%yy-08m-02d,11:47:27
The people risking their lives to save whales,/news/world-us-canada-48998569,%yy-08m-02d,11:47:27
KD Lang on leaving music: 'The muse is eluding me',/news/entertainment-arts-49168221,%yy-08m-02d,11:47:27
Trapped salmon to be airlifted to safety,/news/world-us-canada-49066718,%yy-08m-02d,11:47:27
"A millionaire, a murder and a mystery killer",/news/world-us-canada-49024677,%yy-08m-02d,11:47:27
Boeing crash: I miss them every minute,/news/business-49022003,%yy-08m-02d,11:47:27
The Arctic is on fire - how bad is it?,/news/world-europe-49125391,%yy-08m-02d,11:47:27
BBC World News TV,/news/world_radio_and_tv,%yy-08m-02d,11:47:27
AudioBBC World Service Radio,/sounds/play/live:bbc_world_service,%yy-08m-02d,11:47:27
Video'Now I can make a heart with my hands',/news/world-us-canada-49200369,%yy-08m-02d,11:47:27
VideoHow to untangle a 70-tonne whale,/news/world-us-canada-49199147,%yy-08m-02d,11:47:27
Video'I made a million dollars from eating on YouTube',/news/business-49155693,%yy-08m-02d,11:47:27
Africa's top shots: Afros and green shoots,/news/world-africa-49191690,%yy-08m-02d,11:47:27
Quiz of the week: Who was on Meghan's Vogue cover?,/news/world-49152107,%yy-08m-02d,11:47:27
VideoIs this the 'perfect' wildlife photo?,/news/world-us-canada-49187301,%yy-08m-02d,11:47:27
VideoPlane lands on road and gets 'pulled over',/news/world-us-canada-49199347,%yy-08m-02d,11:47:27
Video'I made a million dollars from eating on YouTube',/news/business-49155693,%yy-08m-02d,11:47:27
Video'It looked like an atomic bomb went off',/news/world-us-canada-49199345,%yy-08m-02d,11:47:27
Video'I'm disabled and I've paid for sex',/news/uk-england-hampshire-48875001,%yy-08m-02d,11:47:27
The women turned away by doctors in Chile,/news/world-latin-america-49110647,%yy-08m-02d,11:47:27
Stacey Dooley: Face to face with bounty hunters,https://www.bbc.co.uk/bbcthree/article/e96db3dd-0c88-48f6-810c-cb10c7d255aa,%yy-08m-02d,11:47:27
‘I’m being mistaken for a Bollywood sex symbol’,/news/world-asia-india-49188935,%yy-08m-02d,11:47:27
The 'microworkers' making your digital life possible,/news/business-48881827,%yy-08m-02d,11:47:27
Only 35 cancer doctors for nation of 40m people,/news/world-africa-49191685,%yy-08m-02d,11:47:27
Where is al-Qaeda now?,/news/world-asia-48056433,%yy-08m-02d,11:47:27
Yemen war: Has anything been achieved?,/news/world-middle-east-49179146,%yy-08m-02d,11:47:27
The holiday village run by spies,/news/stories-43702764,%yy-08m-02d,11:47:27
A mother's heart-breaking choice,https://www.bbc.co.uk/news/extra/gNcHgmLgmv/yazidi-mothers-choice,%yy-08m-02d,11:47:27
What happened to the 2nd Platoon?,https://www.bbc.co.uk/news/resources/idt-sh/Iraq_legacy_of_war,%yy-08m-02d,11:47:27
The murder of Malaciah Thomas,https://www.bbc.co.uk/news/extra/bM7Ycb7XID/The-Murder-Of-Malaciah-Thomas,%yy-08m-02d,11:47:27
The unstoppable rise of Boris Johnson,https://www.bbc.co.uk/news/extra/2gvE3Pa8Gv/Boris_Johnson_battles,%yy-08m-02d,11:47:27
Robert F Kennedy's 22-year old granddaughter dies,/news/world-us-canada-49201449,%yy-08m-02d,11:47:27
No arms race after US-Russia pact collapses - Nato,/news/world-europe-49207281,%yy-08m-02d,11:47:27
Powerful quake off coast of Indonesia,/news/world-asia-49209310,%yy-08m-02d,11:47:27
Katy Perry told to pay $550k to Christian rapper,/news/newsbeat-49202652,%yy-08m-02d,11:47:27
By-election loss for Tories cuts Commons majority,/news/uk-wales-politics-49200636,%yy-08m-02d,11:47:27
Apple and Google stop workers playing back voices,/news/technology-49205092,%yy-08m-02d,11:47:27
Pentagon pushes pause on $10bn AI tech deal,/news/technology-49204132,%yy-08m-02d,11:47:27
Saudi Arabia allows women to travel independently,/news/world-middle-east-49201019,%yy-08m-02d,11:47:27
Stock markets drop on new Trump China tariffs,/news/business-49203034,%yy-08m-02d,11:47:27
Carney warns of instant shock from no-deal Brexit,/news/business-49203426,%yy-08m-02d,11:47:27
What is the future of religion?,https://www.bbc.com/future/story/20190801-tomorrows-gods-what-is-the-future-of-religion,%yy-08m-02d,11:47:27
The trick that makes you overspend,https://www.bbc.com/worklife/article/20190801-the-trick-that-makes-you-overspend,%yy-08m-02d,11:47:27
A building whose shape changes yearly,https://www.bbc.com/travel/story/20190801-the-massive-mosque-built-once-a-year,%yy-08m-02d,11:47:27
The most important relationship of all?,https://www.bbc.com/culture/story/20190801-hollywoods-new-kind-of-love-story,%yy-08m-02d,11:47:27
The puzzle of ancient brain surgery,https://www.bbc.com/earth/story/20160826-why-our-ancestors-drilled-holes-in-each-others-skulls,%yy-08m-02d,11:47:27
The man who can’t forget,https://www.bbc.com/future/story/20190802-the-man-who-can-remember-every-day-of-his-life,%yy-08m-02d,11:47:27
Did Disney shape how you see the world?,https://www.bbc.com/worklife/article/20190724-did-disney-shape-how-you-see-the-world,%yy-08m-02d,11:47:27
"LiveAshes: Burns nears century as Denly falls - in-play clips, radio & text",/sport/live/cricket/47324671,%yy-08m-02d,11:47:27
Man Utd to sign Leicester's Maguire for £80m,/sport/football/48989647,%yy-08m-02d,11:47:27
LiveEFL season build-up - who will win promotion from Championship?,/sport/live/football/49075698,%yy-08m-02d,11:47:27
LiveWomen's British Open: England's Hull two off lead,/sport/live/golf/49131169,%yy-08m-02d,11:47:27
Joshua rematch in UK not happening - Ruiz,/sport/boxing/49203157,%yy-08m-02d,11:47:27
Frappart first woman to referee major Uefa men's match,/sport/football/49206450,%yy-08m-02d,11:47:27
VideoUnbelievable! - Ball hits stumps but Root survives,/sport/av/cricket/49206804,%yy-08m-02d,11:47:27
